{
  "$schema": "https://json-schema.org/draft/2020-12/schema",
  "title": "OrdersUpdateRequest",
  "type": "object",
  "required": ["id", "customerName", "phone", "date", "items"],
  "properties": {
    "id": { "type": ["string", "number"] },
    "customerName": { "type": "string", "minLength": 1 },
    "phone": { "type": "string", "minLength": 1 },
    "date": { "type": "string", "minLength": 1 },
    "status": { "type": "string", "enum": ["pending", "processing", "delivered", "archived"] },
    "items": { "type": "array", "items": { "type": "object" } },
    "expectedUpdatedAt": { "type": "string" },
    "clientRequestId": { "type": "string" }
  },
  "additionalProperties": true
}
